Type,Firm,Role,Link,Years Eligible,Locations,Locations Full,Application Deadline,Pay Hourly Low,Pay Hourly High,Season,Year
Audit,Deloitte,Audit Intern (Summer 2026),https://apply.deloitte.com/en_US/careers/JobDetail/Audit-Assurance-Intern-Financial-Statement-Audit-Summer-2026/303896,Juniors,Los Angeles CA; San Jose CA,Los Angeles CA; San Jose CA,February 22 2026,25.64,51.44,Summer,2026
Audit,Deloitte,Audit & Assurance Intern (Summer 2027),https://apply.deloitte.com/en_US/careers/JobDetail/Audit-Assurance-Intern-Technology-Controls-Advisory-Summer-2027/320060,Juniors,Multiple locations (35+),Baltimore MD; Boise ID; Cincinnati OH; Cleveland OH; Columbus OH; Costa Mesa CA; Dallas TX; Davenport IA; Denver CO; Honolulu HI; Jericho NY; Las Vegas NV; Los Angeles CA; Louisville KY; McLean VA; Midland MI; Minneapolis MN; Morristown NJ; New Orleans LA; New York NY; Omaha NE; Portland OR; Princeton NJ; Richmond VA; Sacramento CA; Salt Lake City UT; San Diego CA; San Francisco CA; San Jose CA; San Juan PR; Seattle WA; St. Louis MO; Stamford CT; Tempe AZ; Tulsa OK,February 22 2027,25.64,51.44,Summer,2027
Audit,Deloitte,Audit & Assurance Intern (Winter 2027),https://apply.deloitte.com/en_US/careers/JobDetail/Audit-Assurance-Intern-Financial-Statement-Audit-Winter-2027/303897,Juniors,Multiple locations (26),Boston MA; Chicago IL; Denver CO; Des Moines IA; Hartford CT; Houston TX; Las Vegas NV; Los Angeles CA; Miami FL; Midland MI; Minneapolis MN; Morristown NJ; Nashville TN; New Orleans LA; New York NY; Omaha NE; Philadelphia PA; Raleigh NC; Richmond VA; Salt Lake City UT; San Francisco CA; San Jose CA; San Juan PR; Seattle WA; Stamford CT; Tempe AZ,February 22 2026,25.64,51.44,Winter,2027
Audit,KPMG,Audit Intern (Summer 2027),https://www.kpmguscareers.com/jobdetail/?jobId=130972,Juniors,Multiple locations (22),Albuquerque NM; Anchorage AK; Baltimore MD; Baton Rouge LA; Boise ID; Cleveland OH; Columbus OH; Denver CO; Des Moines IA; Detroit MI; Hartford CT; Kansas City MO; Los Angeles CA; Milwaukee WI; Minneapolis MN; Philadelphia PA; Portland OR; Providence RI; Seattle WA; St. Louis MO; Tempe AZ; Virginia Beach VA,Rolling basis,29.81,44.23,Summer,2027
Audit,KPMG,Audit Intern (Winter 2027),https://www.kpmguscareers.com/jobdetail/?jobId=130971,Juniors,Multiple locations (35),Albuquerque NM; Anchorage AK; Atlanta GA; Chicago IL; Cincinnati OH; Cleveland OH; Columbus OH; Denver CO; Detroit MI; Harrisburg PA; Jackson MS; Kansas City MO; Los Angeles CA; Louisville KY; McLean VA; Melville NY; Memphis TN; Milwaukee WI; Minneapolis MN; New Orleans LA; New York NY; Oklahoma City OK; Omaha NE; Philadelphia PA; Portland OR; Raleigh NC; Richmond VA; Rochester NY; Seattle WA; Short Hills NJ; St. Louis MO; Stamford CT; Tempe AZ; Virginia Beach VA; Winston-Salem NC,Rolling basis,29.81,44.23,Winter,2027
Audit,BDO,Assurance Intern (Summer 2027),https://ebqb.fa.us2.oraclecloud.com/hcmUI/CandidateExperience/en/sites/CX_1001/jobs/preview/9934/?keyword=intern&mode=job-location,Juniors,Multiple locations (14),Las Vegas NV; San Antonio TX; Greenville SC; Stamford CT; Boston MA; San Francisco CA; Costa Mesa CA; San Diego CA; Phoenix AZ; San Jose CA; Los Angeles CA; Anchorage AK; Raleigh NC; Charlotte NC,Las Vegas NV; San Antonio TX; Greenville SC; Stamford CT; Boston MA; San Francisco CA; Costa Mesa CA; San Diego CA; Phoenix AZ; San Jose CA; Los Angeles CA; Anchorage AK; Raleigh NC; Charlotte NC,Rolling,32,42,Summer,2027
Audit,BDO,Assurance Intern (Winter 2027),https://ebqb.fa.us2.oraclecloud.com/hcmUI/CandidateExperience/en/sites/CX_1001/jobs/preview/9932/?keyword=intern&mode=job-location,Juniors,Multiple locations (8),Chicago IL; Stamford CT; Baltimore MD; Denver CO; Anchorage AK; Cleveland OH; Jacksonville FL; Raleigh NC,Chicago IL; Stamford CT; Baltimore MD; Denver CO; Anchorage AK; Cleveland OH; Jacksonville FL; Raleigh NC,Rolling,32,42,Winter,2027
Audit,RSM,Assurance Intern (Winter 2027),https://jobs.rsmus.com/posting/assurance-intern---winter-2027/JR115847/?page=1,Juniors,Multiple locations (36),Baltimore MD; Boston MA; Cedar Rapids IA; Charlotte NC; Chicago IL; Cincinnati OH; Cleveland OH; Columbus OH; Coral Gables FL; Davenport IA; Denver CO; Des Moines IA; Detroit MI; Fort Lauderdale FL; Hartford CT; Houston TX; Las Vegas NV; Los Angeles CA; Minneapolis MN; Naples FL; Omaha NE; Orlando FL; Peoria IL; Phoenix AZ; Pittsburgh PA; Raleigh NC; Richmond VA; Salt Lake City UT; San Diego CA; San Jose CA; Schaumburg IL; Seattle WA; Sioux Falls SD; Stamford CT; St. Louis MO; Tampa FL,Baltimore MD; Boston MA; Cedar Rapids IA; Charlotte NC; Chicago IL; Cincinnati OH; Cleveland OH; Columbus OH; Coral Gables FL; Davenport IA; Denver CO; Des Moines IA; Detroit MI; Fort Lauderdale FL; Hartford CT; Houston TX; Las Vegas NV; Los Angeles CA; Minneapolis MN; Naples FL; Omaha NE; Orlando FL; Peoria IL; Phoenix AZ; Pittsburgh PA; Raleigh NC; Richmond VA; Salt Lake City UT; San Diego CA; San Jose CA; Schaumburg IL; Seattle WA; Sioux Falls SD; Stamford CT; St. Louis MO; Tampa FL,Rolling,34,40,Winter,2027
Audit,RSM,Assurance Intern (Summer 2027),https://jobs.rsmus.com/posting/assurance-intern--summer-2027/JR115292/?page=1,Juniors,Multiple locations (33),Indianapolis IN; New York NY; Charlotte NC; Coral Gables FL; San Jose CA; St. Louis MO; Irvine CA; Boston MA; San Diego CA; Schaumburg IL; Phoenix AZ; Seattle WA; Peoria IL; Orlando FL; Fort Lauderdale FL; Baltimore MD; Salt Lake City UT; Washington DC; Cincinnati OH; Duluth MN; Pittsburgh PA; McLean VA; Los Angeles CA; Richmond VA; Kansas City MO; Tampa FL; Mishawaka IN; Columbus OH; Raleigh NC; Sioux Falls SD; Dayton OH; Denver CO; Naples FL,Rolling,34,40,Summer,2027
Audit,Withum,Summer Interns 2026,https://www.withum.com/careers/,Sophomores and Juniors,Multiple locations nationwide,Multiple locations nationwide,Rolling,23,32,Summer,2026
Audit,Baker Tilly,Audit Intern (Winter 2027),https://bakertilly.wd5.myworkdayjobs.com/en-US/BTCareers/details/Winter-2027-Audit-Internship_JR104999?workerSubType=4c6f02c70099100105e6e8d050a30002&locations=881b144748dd1001065e4c9680320000&locations=881b144748dd1001065e68d85cce0000&locations=abb9da4a923a1001f19f139748c90000,Juniors,Multiple locations (3),New York NY; Uniondale NY; Iselin NJ,New York NY; Uniondale NY; Iselin NJ,Rolling,29,46,Winter,2027
Audit,Forvis Mazars,Audit Intern (Winter 2027),https://jobs.forvismazars.us/jobs/9991/intern-audit-winter-2027-new-york-city,Juniors,New York NY,New York NY,Rolling,30,31,Winter,2027
Audit,Aprio,Audit Intern (Spring 2027),https://jobs.lever.co/Aprio/7d655d59-2b22-4e3c-b777-3dc3d917c8f7,Juniors,Multiple locations (23),Atlanta GA; Conyers GA; Valdosta GA; Birmingham AL; San Francisco CA; Walnut Creek CA; Los Angeles CA; Denver CO; Miami FL; Chicago IL; Topeka KS; Overland Park KS; Little Falls NJ; Charlotte NC; Greensboro NC; Mount Airy NC; New York NY; Portland OR; Nashville TN; Austin TX; San Antonio TX; Dallas TX; Washington DC Metro,Rolling,23,36,Spring,2027
Audit,Aprio,Audit Intern (Summer 2027),https://jobs.lever.co/Aprio/7d655d59-2b22-4e3c-b777-3dc3d917c8f7,Juniors,Multiple locations (23),Atlanta GA; Conyers GA; Valdosta GA; Birmingham AL; San Francisco CA; Walnut Creek CA; Los Angeles CA; Denver CO; Miami FL; Chicago IL; Topeka KS; Overland Park KS; Little Falls NJ; Charlotte NC; Greensboro NC; Mount Airy NC; New York NY; Portland OR; Nashville TN; Austin TX; San Antonio TX; Dallas TX; Washington DC Metro,Rolling,23,36,Summer,2027
Audit,Crowe,Audit Intern (Summer 2026),https://careers.crowe.com/job/R-46507/Audit-Intern-Summer-2026,Juniors,Multiple locations (5),Chicago IL; Austin TX; Cleveland OH; Columbus OH; Hartford CT,Chicago IL; Austin TX; Cleveland OH; Columbus OH; Hartford CT,Rolling,27,42,Summer,2026
Audit,Crowe,Audit Intern (Winter 2027),https://careers.crowe.com/job/R-47588/Audit-Intern-Winter-2027,Juniors,Multiple locations (23),Chicago IL; Atlanta GA; Austin TX; Boston MA; Burlington VT; Cleveland OH; Columbus OH; Denver CO; Fort Lauderdale FL; Fort Wayne IN; Grand Rapids MI; Hartford CT; Houston TX; Indianapolis IN; Lexington KY; Livingston NJ; Louisville KY; Nashville TN; New York NY; Oakbrook Terrace IL; South Bend IN; Tampa FL; Washington DC,Rolling,27,42,Winter,2027
Audit,Citrin Cooperman,Audit Intern (Winter 2027),https://www.paycomonline.net/v4/ats/web.php/portal/E9A2AA28834E20BD25923E295653B2F6/jobs/232336,Juniors,Multiple locations (12),Jericho NY; Melville NY; San Diego CA; Woodmere OH; Philadelphia PA; Chicago IL; White Plains NY; McLean VA; Bethesda MD; Owings Mills MD; Florham Park NJ; Voorhees NJ,Jericho NY; Melville NY; San Diego CA; Woodmere OH; Philadelphia PA; Chicago IL; White Plains NY; McLean VA; Bethesda MD; Owings Mills MD; Florham Park NJ; Voorhees NJ,Rolling,20,30,Winter,2027
Audit,CLA,Tax/Audit Intern (Summer 2027),https://cliftonlarsonallen.wd1.myworkdayjobs.com/en-US/CLA/details/Tax-Audit-Intern---Summer-2027---Eastern---Central-WA_R15979-1?workerSubType=31d4e51a50e201ef826b42a39a16460f,Juniors,Multiple locations (15),Spokane WA; Wenatchee WA; Moses Lake WA; Yakima WA; Tri Cities WA; Oak Brook IL; Schererville IN; Chicago IL; Sacramento CA; Maumee OH; Findlay OH; Atlanta GA; San Jose CA; Dixon IL; Phoenix AZ,Spokane WA; Wenatchee WA; Moses Lake WA; Yakima WA; Tri Cities WA; Oak Brook IL; Schererville IN; Chicago IL; Sacramento CA; Maumee OH; Findlay OH; Atlanta GA; San Jose CA; Dixon IL; Phoenix AZ,Rolling,19,35,Summer,2027
Audit,CLA,Tax/Audit Intern (Spring 2027),https://cliftonlarsonallen.wd1.myworkdayjobs.com/en-US/CLA/details/Tax-Audit-Interns---Spring-2027---Tucson-AZ_R14905,Juniors,Multiple locations (35),Tucson AZ; Phoenix AZ; Oak Brook IL; Schererville IN; Chicago IL; Des Moines IA; Cedar Rapids IA; Houston TX; Dallas TX; Sacramento CA; Denver CO; Colorado Springs CO; Salt Lake City UT; Atlanta GA; Nashville TN; San Jose CA; Dixon IL; Appleton WI; Neenah WI; Oshkosh WI; Green Bay WI; Manitowoc WI; Eau Claire WI; Maumee OH; Findlay OH; Akron OH; Canton OH; Las Vegas NV; Boise ID; Indianapolis IN; Mankato MN; Rochester MN; Austin MN; Spokane WA; Bethlehem PA,Tucson AZ; Phoenix AZ; Oak Brook IL; Schererville IN; Chicago IL; Des Moines IA; Cedar Rapids IA; Houston TX; Dallas TX; Sacramento CA; Denver CO; Colorado Springs CO; Salt Lake City UT; Atlanta GA; Nashville TN; San Jose CA; Dixon IL; Appleton WI; Neenah WI; Oshkosh WI; Green Bay WI; Manitowoc WI; Eau Claire WI; Maumee OH; Findlay OH; Akron OH; Canton OH; Las Vegas NV; Boise ID; Indianapolis IN; Mankato MN; Rochester MN; Austin MN; Spokane WA; Bethlehem PA,Rolling,25,35,Spring,2027
Audit,Wipfli,Accounting Intern (Spring 2027),https://careers.wipfli.com/campus-recruiting,Juniors,Multiple locations (9),Wausau WI; Clayton MO; St. Charles MO; Helena MT; Billings MT; Great Falls MT; South Portland ME; Bedford NH; Spokane WA,Wausau WI; Clayton MO; St. Charles MO; Helena MT; Billings MT; Great Falls MT; South Portland ME; Bedford NH; Spokane WA,Rolling,,,Spring,2027
Audit,Wipfli,Accounting Intern (Summer 2027),https://careers.wipfli.com/jobs/entry-level-internships/us-wi-eau-claire/accounting-internship-summer-2027/7740?q=intern&size=n_25_n,Juniors,Multiple locations (5),Bedford NH; Eau Claire WI; South Portland ME; Green Bay WI; Minneapolis MN,Bedford NH; Eau Claire WI; South Portland ME; Green Bay WI; Minneapolis MN,Rolling,,,Summer,2027
Tax,BDO,"Specialty Tax Services Intern, State and Local Tax (Summer 2027)",https://ebqb.fa.us2.oraclecloud.com/hcmUI/CandidateExperience/en/sites/CX_1001/jobs/preview/11512/?keyword=intern&mode=job-location,Juniors,Multiple locations (11),Boston MA; Los Angeles CA; Costa Mesa CA; Grand Rapids MI; Fort Lauderdale FL; Milwaukee WI; Minneapolis MN; Charlotte NC; Dallas TX; Houston TX; Atlanta GA,Boston MA; Los Angeles CA; Costa Mesa CA; Grand Rapids MI; Fort Lauderdale FL; Milwaukee WI; Minneapolis MN; Charlotte NC; Dallas TX; Houston TX; Atlanta GA,Rolling,32,45,Summer,2027
Tax,BDO,"Specialty Tax Services Intern, Business Incentive Group (Summer 2027)",https://ebqb.fa.us2.oraclecloud.com/hcmUI/CandidateExperience/en/sites/CX_1001/jobs/preview/11497/?keyword=intern&mode=job-location,Juniors,Multiple locations (7),New York NY; Atlanta GA; Houston TX; Chicago IL; McLean VA; Dallas TX; Los Angeles CA,New York NY; Atlanta GA; Houston TX; Chicago IL; McLean VA; Dallas TX; Los Angeles CA,Rolling,32,45,Summer,2027
Tax,BDO,"Specialty Tax Services Intern, International Tax Services (Summer 2027)",https://ebqb.fa.us2.oraclecloud.com/hcmUI/CandidateExperience/en/sites/CX_1001/jobs/preview/11434/?keyword=intern&mode=job-location,Juniors,Multiple locations (11),Tampa FL; Boston MA; Atlanta GA; Houston TX; Milwaukee WI; Costa Mesa CA; Los Angeles CA; Dallas TX; Miami FL; Nashville TN; Chicago IL,Tampa FL; Boston MA; Atlanta GA; Houston TX; Milwaukee WI; Costa Mesa CA; Los Angeles CA; Dallas TX; Miami FL; Nashville TN; Chicago IL,Rolling,32,45,Summer,2027
Tax,BDO,"Specialty Tax Services Intern, Transfer Pricing (Summer 2027)",https://ebqb.fa.us2.oraclecloud.com/hcmUI/CandidateExperience/en/sites/CX_1001/jobs/preview/11431/?keyword=intern&mode=job-location,Juniors,Multiple locations (7),Boston MA; Atlanta GA; McLean VA; Los Angeles CA; Miami FL; Houston TX; Minneapolis MN,Boston MA; Atlanta GA; McLean VA; Los Angeles CA; Miami FL; Houston TX; Minneapolis MN,Rolling,32,45,Summer,2027
Tax,KPMG,Tax Intern (Winter 2027),https://www.kpmguscareers.com/jobdetail/?jobId=130985,Juniors,Multiple locations (8),Charlotte NC; Denver CO; Detroit MI; Minneapolis MN; New York NY; Raleigh NC; Short Hills NJ; Virginia Beach VA,Rolling basis,29.81,44.23,Winter,2027
Tax,Andersen,Tax Services Intern (2027),https://careers.andersen.com/jobs/7154?lang=en-us,Juniors,Multiple locations (5),West Palm Beach FL; Dallas TX; Chicago IL; Des Moines IA; Tampa FL,West Palm Beach FL; Dallas TX; Chicago IL; Des Moines IA; Tampa FL,Rolling,,,Winter/Spring/Summer,2027
Tax,Citrin Cooperman,Tax Intern (Winter 2027),https://www.paycomonline.net/v4/ats/web.php/portal/E9A2AA28834E20BD25923E295653B2F6/jobs/49576,Juniors,Multiple locations (18),Braintree MA; San Diego CA; Chicago IL; New York NY; Woodmere OH; Middleburg Heights OH; Westerville OH; McLean VA; Bethesda MD; Owings Mills MD; Philadelphia PA; Providence RI; Florham Park NJ; Voorhees NJ; White Plains NY; Worcester MA; Coral Gables FL; Jericho NY,Braintree MA; San Diego CA; Chicago IL; New York NY; Woodmere OH; Middleburg Heights OH; Westerville OH; McLean VA; Bethesda MD; Owings Mills MD; Philadelphia PA; Providence RI; Florham Park NJ; Voorhees NJ; White Plains NY; Worcester MA; Coral Gables FL; Jericho NY,Rolling,20,30,Winter,2027
Tax,CLA,Tax/Audit Intern (Summer 2027),https://cliftonlarsonallen.wd1.myworkdayjobs.com/en-US/CLA/details/Tax-Audit-Intern---Summer-2027---Eastern---Central-WA_R15979-1?workerSubType=31d4e51a50e201ef826b42a39a16460f,Juniors,Multiple locations (15),Spokane WA; Wenatchee WA; Moses Lake WA; Yakima WA; Tri Cities WA; Oak Brook IL; Schererville IN; Chicago IL; Sacramento CA; Maumee OH; Findlay OH; Atlanta GA; San Jose CA; Dixon IL; Phoenix AZ,Spokane WA; Wenatchee WA; Moses Lake WA; Yakima WA; Tri Cities WA; Oak Brook IL; Schererville IN; Chicago IL; Sacramento CA; Maumee OH; Findlay OH; Atlanta GA; San Jose CA; Dixon IL; Phoenix AZ,Rolling,19,35,Summer,2027
Tax,CLA,Tax/Audit Intern (Spring 2027),https://cliftonlarsonallen.wd1.myworkdayjobs.com/en-US/CLA/details/Tax-Audit-Interns---Spring-2027---Tucson-AZ_R14905,Juniors,Multiple locations (35),Tucson AZ; Phoenix AZ; Oak Brook IL; Schererville IN; Chicago IL; Des Moines IA; Cedar Rapids IA; Houston TX; Dallas TX; Sacramento CA; Denver CO; Colorado Springs CO; Salt Lake City UT; Atlanta GA; Nashville TN; San Jose CA; Dixon IL; Appleton WI; Neenah WI; Oshkosh WI; Green Bay WI; Manitowoc WI; Eau Claire WI; Maumee OH; Findlay OH; Akron OH; Canton OH; Las Vegas NV; Boise ID; Indianapolis IN; Mankato MN; Rochester MN; Austin MN; Spokane WA; Bethlehem PA,Tucson AZ; Phoenix AZ; Oak Brook IL; Schererville IN; Chicago IL; Des Moines IA; Cedar Rapids IA; Houston TX; Dallas TX; Sacramento CA; Denver CO; Colorado Springs CO; Salt Lake City UT; Atlanta GA; Nashville TN; San Jose CA; Dixon IL; Appleton WI; Neenah WI; Oshkosh WI; Green Bay WI; Manitowoc WI; Eau Claire WI; Maumee OH; Findlay OH; Akron OH; Canton OH; Las Vegas NV; Boise ID; Indianapolis IN; Mankato MN; Rochester MN; Austin MN; Spokane WA; Bethlehem PA,Rolling,25,35,Spring,2027
Tax,Wipfli,Accounting Intern (Spring 2027),https://careers.wipfli.com/campus-recruiting,Juniors,Multiple locations (9),Wausau WI; Clayton MO; St. Charles MO; Helena MT; Billings MT; Great Falls MT; South Portland ME; Bedford NH; Spokane WA,Wausau WI; Clayton MO; St. Charles MO; Helena MT; Billings MT; Great Falls MT; South Portland ME; Bedford NH; Spokane WA,Rolling,,,Spring,2027
Tax,Wipfli,Accounting Intern (Summer 2027),https://careers.wipfli.com/jobs/entry-level-internships/us-wi-eau-claire/accounting-internship-summer-2027/7740?q=intern&size=n_25_n,Juniors,Multiple locations (5),Bedford NH; Eau Claire WI; South Portland ME; Green Bay WI; Minneapolis MN,Bedford NH; Eau Claire WI; South Portland ME; Green Bay WI; Minneapolis MN,Rolling,,,Summer,2027
Tax,RSM,Federal Tax Services Intern,https://jobs.rsmus.com/posting/federal-tax-services-intern---winter-2027/JR109265,Juniors,Multiple locations (30),Baltimore MD; Boston MA; Cedar Rapids IA; Chicago IL; Davenport IA; Dayton OH; Denver CO; Des Moines IA; Detroit MI; Duluth MN; Iowa City IA; Los Angeles CA; McLean VA; Melbourne FL; Minneapolis MN; Mishawaka IN; Naples FL; Omaha NE; Orlando FL; Phoenix AZ; Raleigh NC; Richmond VA; Salt Lake City UT; San Antonio TX; San Jose CA; Schaumburg IL; Seattle WA; Sioux Falls SD; St. Louis MO; Tampa FL,Baltimore MD; Boston MA; Cedar Rapids IA; Chicago IL; Davenport IA; Dayton OH; Denver CO; Des Moines IA; Detroit MI; Duluth MN; Iowa City IA; Los Angeles CA; McLean VA; Melbourne FL; Minneapolis MN; Mishawaka IN; Naples FL; Omaha NE; Orlando FL; Phoenix AZ; Raleigh NC; Richmond VA; Salt Lake City UT; San Antonio TX; San Jose CA; Schaumburg IL; Seattle WA; Sioux Falls SD; St. Louis MO; Tampa FL,Rolling,36,43,Winter,2027
Tax,Withum,Summer Interns 2026,https://www.withum.com/careers/,Sophomores and Juniors,Multiple locations nationwide,Multiple locations nationwide,Rolling,23,32,Summer,2026
Tax,Aprio,Tax Intern (Spring 2027),https://jobs.lever.co/Aprio/7d655d59-2b22-4e3c-b777-3dc3d917c8f7,Juniors,Multiple locations (23),Atlanta GA; Conyers GA; Valdosta GA; Birmingham AL; San Francisco CA; Walnut Creek CA; Los Angeles CA; Denver CO; Miami FL; Chicago IL; Topeka KS; Overland Park KS; Little Falls NJ; Charlotte NC; Greensboro NC; Mount Airy NC; New York NY; Portland OR; Nashville TN; Austin TX; San Antonio TX; Dallas TX; Washington DC Metro,Rolling,23,36,Spring,2027
Tax,Aprio,Tax Intern (Summer 2027),https://jobs.lever.co/Aprio/7d655d59-2b22-4e3c-b777-3dc3d917c8f7,Juniors,Multiple locations (23),Atlanta GA; Conyers GA; Valdosta GA; Birmingham AL; San Francisco CA; Walnut Creek CA; Los Angeles CA; Denver CO; Miami FL; Chicago IL; Topeka KS; Overland Park KS; Little Falls NJ; Charlotte NC; Greensboro NC; Mount Airy NC; New York NY; Portland OR; Nashville TN; Austin TX; San Antonio TX; Dallas TX; Washington DC Metro,Rolling,23,36,Summer,2027
Tax,Crowe,Tax Intern (Summer 2026),https://careers.crowe.com/job/R-46098/Tax-Intern-Summer-2026,Juniors,Multiple locations (23),Chicago IL; Atlanta GA; Austin TX; Boston MA; Columbus OH; Costa Mesa CA; Dallas TX; Denver CO; Fort Lauderdale FL; Fort Wayne IN; Grand Rapids MI; Houston TX; Indianapolis IN; Lexington KY; Los Angeles CA; Louisville KY; Nashville TN; New York NY; Oakbrook Terrace IL; Sacramento CA; San Francisco CA; South Bend IN; Washington DC,Rolling,27,42,Summer,2026
Tax,Baker Tilly,Tax Intern (Summer 2026),https://bakertilly.wd5.myworkdayjobs.com/BTCareers/job/USA-MA-Tewksbury/Summer-2026-Tax-Internship_JR104996,Juniors,Tewksbury MA,Tewksbury MA,Rolling,29,46,Summer,2026
Tax,Baker Tilly,Tax Intern (Winter 2027),https://bakertilly.wd5.myworkdayjobs.com/en-US/BTCareers/details/Winter-2027-Tax-Internship_JR105000?workerSubType=4c6f02c70099100105e6e8d050a30002&locations=881b144748dd1001065e4c9680320000&locations=881b144748dd1001065e68d85cce0000&locations=abb9da4a923a1001f19f139748c90000,Juniors,Multiple locations (3),New York NY; Uniondale NY; Iselin NJ,New York NY; Uniondale NY; Iselin NJ,Rolling,29,46,Winter,2027
Tax,Forvis Mazars,Tax Intern (Winter 2027),https://www.forvismazars.us/careers/careers-for-students,Juniors,New York NY,New York NY,Rolling,30,31,Winter,2027
Tax,Crowe,Tax Intern (Winter 2027),https://careers.crowe.com/job/R-47932/Tax-Intern-Winter-2027,Juniors,Multiple locations (21),Chicago IL; Atlanta GA; Austin TX; Boston MA; Columbus OH; Costa Mesa CA; Denver CO; Fort Lauderdale FL; Fort Wayne IN; Grand Rapids MI; Houston TX; Indianapolis IN; Lexington KY; Louisville KY; Nashville TN; New York NY; Oakbrook Terrace IL; Sacramento CA; San Francisco CA; South Bend IN; Tampa FL,Rolling,27,42,Winter,2027
Advisory,RSM,Transaction Advisory Consulting Intern (Summer 2027),https://jobs.rsmus.com/posting/transaction-advisory-consulting-intern--summer-2027/JR118047/?page=1,Juniors,Boston MA; Chicago IL; Dallas TX; Coral Gables FL; New York NY; Philadelphia PA; San Francisco CA; Tampa FL,Boston MA; Chicago IL; Dallas TX; Coral Gables FL; New York NY; Philadelphia PA; San Francisco CA; Tampa FL,Rolling,32,40,Summer,2027
